{
  "$schema": "https://json-schema.org/draft/2020-12/schema",
  "$id": "https://github.com/smyrdev/samy-workout-skills/skills/generation/assets/schema/rules.schema.json",
  "title": "Personal generation rules",
  "description": "The parsed form of profile/rules.md — hand-written by the person as Markdown (## sections, - bullets), read (never written) by the generation skill. This schema describes what generate.py parses that file into, and the shape of default_rules in generate.config.json; the person never types JSON. Every section is optional: anything absent falls back to default_rules, and present sections override the default key-by-key.",
  "type": "object",
  "additionalProperties": false,
  "properties": {
    "$schema_version": {
      "const": "1.0",
      "description": "Legacy only — a pre-Markdown profile/rules.json still carries it. rules.md has no equivalent and needs none."
    },
    "exclude": {
      "description": "Filtered out before any exercise is picked. Unknown names are reported as warnings, never silently skipped.",
      "type": "object",
      "additionalProperties": false,
      "properties": {
        "exercises": {
          "type": "array",
          "items": { "type": "string", "minLength": 1 },
          "description": "Exact dataset exercise names, case-insensitive."
        },
        "equipment": {
          "type": "array",
          "items": { "type": "string", "minLength": 1 },
          "description": "Dataset equipment values to avoid even when the gym tier allows them."
        },
        "movement_groups": {
          "type": "array",
          "items": { "type": "string", "minLength": 1 },
          "description": "Dataset movement-group values to avoid entirely."
        },
        "muscles": {
          "type": "array",
          "items": {
            "enum": ["chest", "back", "shoulders", "biceps", "triceps",
                     "quads", "hamstrings", "glutes", "calves", "core"]
          },
          "description": "Muscle groups to drop from the plan entirely (injury, personal choice)."
        }
      }
    },
    "focus": {
      "type": "object",
      "additionalProperties": false,
      "properties": {
        "muscles": {
          "type": "array",
          "items": {
            "enum": ["chest", "back", "shoulders", "biceps", "triceps",
                     "quads", "hamstrings", "glutes", "calves", "core"]
          },
          "description": "Groups this program biases toward when picking exercises."
        },
        "must_include": {
          "type": "array",
          "items": { "type": "string", "minLength": 1 },
          "description": "Exact dataset exercise names guaranteed a slot when equipment and gates allow."
        }
      }
    },
    "order": {
      "type": "array",
      "items": {
        "enum": ["must_include_first", "trailer_groups_last", "compound_before_isolation",
                 "focus_muscles_first", "large_groups_before_small"]
      },
      "description": "Session ordering rules, applied top-down: the first rule is the primary sort key, each later rule breaks remaining ties."
    }
  }
}
