{
  "$schema_version": "1.0",
  "exclude": {
    "exercises": [
      "barbell upright row",
      "smith behind neck press",
      "barbell seated behind head military press",
      "barbell good morning"
    ],
    "equipment": ["smith machine"],
    "movement_groups": [],
    "muscles": []
  },
  "focus": {
    "muscles": ["chest", "biceps"],
    "must_include": ["barbell bench press", "barbell deadlift"]
  },
  "order": [
    "must_include_first",
    "trailer_groups_last",
    "compound_before_isolation",
    "focus_muscles_first",
    "large_groups_before_small"
  ]
}
